name,content_text,links
Уход за стеклами автомобиля,"## Уход за стеклами автомобиля
Данный процесс является неотъемлемой частью как при стандартной эксплуатации так и в направлении детейлинга. Чистое остекление - залог, в первую очередь, безопасного движения на дороге, а также комфорт при эксплуатации авто. Также, щетки стеклоочистителя требуют определено но ухода и своим ресурсом работы, который не так велик как многие думают. Уход за стеклами может быть как на уровне стандартной чистки спиртовым очистителем, так и периодической чисткой с помощью полировальной машинки от водного камня с последующим нанесением «антидождя»
### Способы очистки стекла
  * Удаление жировых отложений при помощи спиртовых очистителей. Здесь все просто - наносим на чистую [микрофибру для стёкол](https://sappo.ru/blog/sam-sebe-detailer/kak-vybrat-dvorniki-dlya-avtomobilya-sovety-po-vyboru/<https:/sappo.ru/product/mikrofibra_dlya_stekol_i_zerkal_unifiber_glass_40_x_40_sm_seraya_megashiner/>) (она практически не имеет ворса) небольшое кол-во [очистителя](https://sappo.ru/blog/sam-sebe-detailer/kak-vybrat-dvorniki-dlya-avtomobilya-sovety-po-vyboru/<https:/sappo.ru/product/ochistitel_dlya_stekla_clarify_500_ml_carpro/>) и протираем всю плоскость. Лобовое и заднее стекло можно разделить пополам. Такая процедура выполняется как снаружи, так и изнутри по мере необходимости. Выполнять данный процесс следует на заранее помытом авто
  * Удаление водного камня. Процесс более требовательный, но и эффективней. Водный камень отлично видно на мокрой поверхности (например, когда щетки стеклоочистителя делают взмах и на бликах от освещения видно некие «подтеки»). Можно использовать [абразивные очистители для стекол в виде пасты](https://sappo.ru/blog/sam-sebe-detailer/kak-vybrat-dvorniki-dlya-avtomobilya-sovety-po-vyboru/<https:/sappo.ru/product/gl_glass_clean_polirol_stekla_250_ml_detail/>) или [очиститель в виде спрея](https://sappo.ru/blog/sam-sebe-detailer/kak-vybrat-dvorniki-dlya-avtomobilya-sovety-po-vyboru/<https:/sappo.ru/product/cp_70_ochistitel_dlya_stekla_vodnykh_pyaten_spotless_2_0_500_ml_carpro/>) и [фетрового кубика](https://sappo.ru/blog/sam-sebe-detailer/kak-vybrat-dvorniki-dlya-avtomobilya-sovety-po-vyboru/<https:/sappo.ru/product/applikator_dlya_ochistki_stekla_glass_cleaner_block_megashiner/>)/микрофибры. В случае с пастой и аппликатором - автомобиль следует помыть в 2 фазы и после выполнить «скрабирование» стекол по мокрой поверхности. Результат будет виден после смыва - вода, скатывается «шторой» со стекла, при необходимости повторить и высушить автомобиль. Спреи работают на сухой поверхности и помогают от слабого налета. Наносим состав на микрофибру и со средним усиливаем протираем по стеклу. Здесь чуть лучше видно какой участок следует проработать. Как итог - стекло будет идеально чистое и не иметь полупрозрачных подтеков. Затем, выполнить стандартную протирку с помощью спиртового очистителя и опционально нанести [антидождь](https://sappo.ru/blog/sam-sebe-detailer/kak-vybrat-dvorniki-dlya-avtomobilya-sovety-po-vyboru/<https:/sappo.ru/product/antidozhd_glaco_ultra_polirol_pokrytie_dlya_stekla_70_ml/>) (для закрепления разультата).
  * Чистка стекла при помощи машинки. Авто необходимо помыть, высушить, заклеить [скотчем](https://sappo.ru/blog/sam-sebe-detailer/kak-vybrat-dvorniki-dlya-avtomobilya-sovety-po-vyboru/<https:/sappo.ru/product/lenta_maskiruyushchaya_masking_tape_30_mm_x_50_m_megashiner/>) оконные рейлинги/рамки, кузов желательно укрыть [целлофановой пленкой](https://sappo.ru/blog/sam-sebe-detailer/kak-vybrat-dvorniki-dlya-avtomobilya-sovety-po-vyboru/<https:/sappo.ru/product/maskiruyushchaya_plenka_hdpe_belyy_prozrachnyy_polietilen_rul_4kh150_m/>). Чистка будет осуществляться [ротационной машинкой](https://sappo.ru/blog/sam-sebe-detailer/kak-vybrat-dvorniki-dlya-avtomobilya-sovety-po-vyboru/<https:/sappo.ru/product/rotornaya_polirovalnaya_mashinka_1200_vt_ewocar/>) и [фетровым кругом](https://sappo.ru/blog/sam-sebe-detailer/kak-vybrat-dvorniki-dlya-avtomobilya-sovety-po-vyboru/<https:/sappo.ru/product/krug_dlya_polirovki_stekla_poliviskoz_150mm_a_302_felt_polishing_pad/>). Края стекла чистим при помощи [аппликатора](https://sappo.ru/blog/sam-sebe-detailer/kak-vybrat-dvorniki-dlya-avtomobilya-sovety-po-vyboru/<https:/sappo.ru/product/applikator_dlya_ochistki_stekla_glass_cleaner_block_megashiner/>). Наносим небольшое кол-во воды на стекло, выполняем загрузку круга [пастой для чистки или полировки стекол](https://sappo.ru/blog/sam-sebe-detailer/kak-vybrat-dvorniki-dlya-avtomobilya-sovety-po-vyboru/<https:/sappo.ru/product/glasspolish_polirovalnaya_pasta_dlya_stekla_200ml_shinesystems/>) и начинаем вырабатывать её начиная с 800 до 1300 об.мин. Сильного давления не стоит оказывать и периодически смачивайте полируемую поверхность. Также, не держите машинку в одном месте - стекло может лопнуть! Участок следует выбирать в размер 3-4 площади круга по вертикали и горизонтали. 1 подход полировки составляет примерно 3-5 минут, затем проверяем результат: при удалении состава [влажной фиброй](https://sappo.ru/blog/sam-sebe-detailer/kak-vybrat-dvorniki-dlya-avtomobilya-sovety-po-vyboru/<https:/sappo.ru/product/mikrofibra_universalnaya_unifiber_40x40_sm_400_gr_m2_golubaya_megashiner/>), не должно остаться никаких подтеков и следов - исключительно чистое стекло! Далее на обезжиренную поверхность наносим сам антидождь согласно инструкции 
### Особенности эксплуатации щеток стеклоочистителя
Отдельно стоит рассмотреть и уход за дворниками. Важна их своевременная замена - срок службы в среднем 4-6 месяцев (если говорить о хороших производителях). При каждой мойке стоит промывать «резинку» с помощью [кисти](https://sappo.ru/blog/sam-sebe-detailer/kak-vybrat-dvorniki-dlya-avtomobilya-sovety-po-vyboru/<https:/sappo.ru/product/kist_dlya_deteylinga_c_naturalnym_vorsom_brown_detailing_brush_14_megashiner/>) и также осуществлять её сушку [полотенцем](https://sappo.ru/blog/sam-sebe-detailer/kak-vybrat-dvorniki-dlya-avtomobilya-sovety-po-vyboru/<https:/sappo.ru/product/car_drying_towel_mikrofibra_dlya_sushki_avtomobilya_50_x_70_sm_600_gr_m2_megashiner/>). Помните, что резина - это техническое изделие которое подверженно растрескиванию, деформации и иссыханию. Из народных лайфхаков подойдет вариант с натиранием резинок графитовым стержнем (некоторые щетки идут с графитовым напылением, но в условиях нашего климата - графит явно не будет лишним). Перед нанесением антидождя - щетки стоит очистить сначала [апельсинкой](https://sappo.ru/blog/sam-sebe-detailer/kak-vybrat-dvorniki-dlya-avtomobilya-sovety-po-vyboru/<https:/sappo.ru/product/citruscleaner_apelsinovyy_ochistitel_200_ml_shine_systems_/>), затем обезжирить [спиртовым раствором](https://sappo.ru/blog/sam-sebe-detailer/kak-vybrat-dvorniki-dlya-avtomobilya-sovety-po-vyboru/<https:/sappo.ru/product/shine_systems_ipa_antisilikon_obezzhirivatel_na_spirtovoy_osnove_750_ml/>) и при нанесении антидождя - стоит нанести немного состава и на резинки этих щеток. При эффекте прыжка дворников - стоит обратить внимания на «поводок» - некая пружинка которая создает натяжение (из-за неё зачастую и возникают все проблемы). 
В данном блоке были рассмотрены варианты чистки стекла от сложных загрязнений, а также небольшое повествование на тему щеток. Старайтесь выбирать хорошие составы для комфортной работы и комфортной эксплуатации, такие позиции можно найти на нашем сайте Sappo.ru 
Чтобы заказать аксессуары, обращайтесь в магазины Sappo.ru. Для заказа онлайн предлагаем каталог и консультации на сайте. Офлайн работают два наших магазина:
  * г. Москва, ул. Складочная 1, стр. 1 (БП «Станколит»): телефон [8 499 350-11-04](https://sappo.ru/blog/sam-sebe-detailer/kak-vybrat-dvorniki-dlya-avtomobilya-sovety-po-vyboru/<tel:8 499 350-11-04>), электронный адрес для связи — msk@sappo.ru;
  * г. Санкт-Петербург, ул. Типанова, д. 21, 2 этаж, Торговый центр «Питер»: телефон [8 800 350-11-04](https://sappo.ru/blog/sam-sebe-detailer/kak-vybrat-dvorniki-dlya-avtomobilya-sovety-po-vyboru/<tel:8 499 350-11-04>), электронный адрес для связи — info@sappo.ru.  
: Sappo","https://sappo.ru/blog/sam-sebe-detailer/kak-vybrat-dvorniki-dlya-avtomobilya-sovety-po-vyboru/<https:/sappo.ru/product/mikrofibra_dlya_stekol_i_zerkal_unifiber_glass_40_x_40_sm_seraya_megashiner/>, https://sappo.ru/blog/sam-sebe-detailer/kak-vybrat-dvorniki-dlya-avtomobilya-sovety-po-vyboru/<https:/sappo.ru/product/ochistitel_dlya_stekla_clarify_500_ml_carpro/>, https://sappo.ru/blog/sam-sebe-detailer/kak-vybrat-dvorniki-dlya-avtomobilya-sovety-po-vyboru/<https:/sappo.ru/product/gl_glass_clean_polirol_stekla_250_ml_detail/>, https://sappo.ru/blog/sam-sebe-detailer/kak-vybrat-dvorniki-dlya-avtomobilya-sovety-po-vyboru/<https:/sappo.ru/product/cp_70_ochistitel_dlya_stekla_vodnykh_pyaten_spotless_2_0_500_ml_carpro/>, https://sappo.ru/blog/sam-sebe-detailer/kak-vybrat-dvorniki-dlya-avtomobilya-sovety-po-vyboru/<https:/sappo.ru/product/applikator_dlya_ochistki_stekla_glass_cleaner_block_megashiner/>, https://sappo.ru/blog/sam-sebe-detailer/kak-vybrat-dvorniki-dlya-avtomobilya-sovety-po-vyboru/<https:/sappo.ru/product/antidozhd_glaco_ultra_polirol_pokrytie_dlya_stekla_70_ml/>, https://sappo.ru/blog/sam-sebe-detailer/kak-vybrat-dvorniki-dlya-avtomobilya-sovety-po-vyboru/<https:/sappo.ru/product/lenta_maskiruyushchaya_masking_tape_30_mm_x_50_m_megashiner/>, https://sappo.ru/blog/sam-sebe-detailer/kak-vybrat-dvorniki-dlya-avtomobilya-sovety-po-vyboru/<https:/sappo.ru/product/maskiruyushchaya_plenka_hdpe_belyy_prozrachnyy_polietilen_rul_4kh150_m/>, https://sappo.ru/blog/sam-sebe-detailer/kak-vybrat-dvorniki-dlya-avtomobilya-sovety-po-vyboru/<https:/sappo.ru/product/rotornaya_polirovalnaya_mashinka_1200_vt_ewocar/>, https://sappo.ru/blog/sam-sebe-detailer/kak-vybrat-dvorniki-dlya-avtomobilya-sovety-po-vyboru/<https:/sappo.ru/product/krug_dlya_polirovki_stekla_poliviskoz_150mm_a_302_felt_polishing_pad/>, https://sappo.ru/blog/sam-sebe-detailer/kak-vybrat-dvorniki-dlya-avtomobilya-sovety-po-vyboru/<https:/sappo.ru/product/glasspolish_polirovalnaya_pasta_dlya_stekla_200ml_shinesystems/>, https://sappo.ru/blog/sam-sebe-detailer/kak-vybrat-dvorniki-dlya-avtomobilya-sovety-po-vyboru/<https:/sappo.ru/product/mikrofibra_universalnaya_unifiber_40x40_sm_400_gr_m2_golubaya_megashiner/>, https://sappo.ru/blog/sam-sebe-detailer/kak-vybrat-dvorniki-dlya-avtomobilya-sovety-po-vyboru/<https:/sappo.ru/product/kist_dlya_deteylinga_c_naturalnym_vorsom_brown_detailing_brush_14_megashiner/>, https://sappo.ru/blog/sam-sebe-detailer/kak-vybrat-dvorniki-dlya-avtomobilya-sovety-po-vyboru/<https:/sappo.ru/product/car_drying_towel_mikrofibra_dlya_sushki_avtomobilya_50_x_70_sm_600_gr_m2_megashiner/>, https://sappo.ru/blog/sam-sebe-detailer/kak-vybrat-dvorniki-dlya-avtomobilya-sovety-po-vyboru/<https:/sappo.ru/product/citruscleaner_apelsinovyy_ochistitel_200_ml_shine_systems_/>, https://sappo.ru/blog/sam-sebe-detailer/kak-vybrat-dvorniki-dlya-avtomobilya-sovety-po-vyboru/<https:/sappo.ru/product/shine_systems_ipa_antisilikon_obezzhirivatel_na_spirtovoy_osnove_750_ml/>, https://sappo.ru/blog/sam-sebe-detailer/kak-vybrat-dvorniki-dlya-avtomobilya-sovety-po-vyboru/<tel:8 499 350-11-04>, https://sappo.ru/blog/sam-sebe-detailer/kak-vybrat-dvorniki-dlya-avtomobilya-sovety-po-vyboru/<tel:8 499 350-11-04>"
