name,content_text,links
Какие дворники лучше купить для авто. Что нужно учесть,"Это важный элемент автомобиля, обеспечивающий хорошую видимость в любую погоду. Неправильно выбранные или изношенные щетки стеклоочистителя могут снизить безопасность езды. Разберем, что нужно знать, чтобы выбрать дворники на машину и как продлить срок их службы.
## Какие дворники лучше купить для авто. Что нужно учесть 
Выбор подходящих стеклоочистителей обеспечит комфортное, безопасное управление автомобилем в дождливую, туманную погоду. Учитывая выбор моделей и материалов, важно понимать, какие аксессуары подойдут именно вашему авто и стилю эксплуатации.
Вот как выбрать щетки стеклоочистителя для автомобиля правильно:
  1. Определите совместимость. Длина щеток должна соответствовать рекомендациям производителя автомобиля. Обычно размер водительской и пассажирской щеток отличается. Также важно оценить крепления. На рынке представлены варианты типа «крючок», «кнопка», «штыковое», «боковой фиксатор».
  2. Учитывайте климатические условия. Для холодных зим предпочтительны модели с защитой от обледенения, например, гибридные модели. В регионах с мягким климатом подойдут бескаркасные или каркасные щетки.
  3. Уточните качество материалов. С резиновой кромкой обеспечивают мягкое скольжение, но быстрее изнашиваются. Силиконовые модели служат дольше, устойчивы к ультрафиолету и перепадам температур. 
Как подобрать качественные дворники для автомобиля? Учитываем тип. Популярны три варианта:
  * Каркасные, то есть классические модели с металлическим каркасом. Они хорошо справляются с очисткой благодаря точному прижиму, но подвержены коррозии.
  * Бескаркасные — легкие и аэродинамичные. Обеспечивают равномерное прилегание(и на высоких скоростях).
  * Гибридные: сочетают плюсы каркасных и бескаркасных щеток. Обладают современным дизайном и высокой износостойкостью. В каталоге Sappo.ru именно гибридные варианты — например, [Denso Hybrid DU-045L](https://sappo.ru/blog/sam-sebe-detailer/kak-vybrat-dvorniki-dlya-avtomobilya-sovety-po-vyboru/<https:/sappo.ru/product/denso_hybrid_du_045l_shchetka_stekloochistitelya_gibridnaya_450_mm_/>) длиной 450 мм. Они подходят для снежных зим.  
Важно знать, как подобрать дворники на автомобиль, а также соблюдать рекомендации по уходу. К ним относятся: 
  1. Регулярная очистка: протирайте прилегающие поверхности влажной тряпкой, чтобы удалить грязь и пыль.
  2. Проверка наличия повреждений на резиновой кромке.
  3. Сезонная замена: используйте зимние дворники, если часто ездите в снег или дождь. Они устойчивы к наледи и морозам. А вот летние лучше справляются с пылью и насекомыми.
  4. Применение качественной омывающей жидкости: это снижает износ щеток, улучшая их эффективность.
  5. Запрет на включение дворников на сухом стекле: это приводит к повреждению резины и ухудшению качества очистки. 
Как понять, что дворники пора менять? Это необходимо, если стеклоочистители стали оставлять полосы или пропуски, а также если на чистящей поверхности стала трескаться или отслаиваться резина, а при работе слышны скрип или шум. Расскажем о том, какие дворники (щетки стеклоочистителя для автомобиля) лучше выбрать. 
Своевременная замена и правильный уход за дворниками гарантируют вам отличную видимость и безопасность в любую погоду.",https://sappo.ru/blog/sam-sebe-detailer/kak-vybrat-dvorniki-dlya-avtomobilya-sovety-po-vyboru/<https:/sappo.ru/product/denso_hybrid_du_045l_shchetka_stekloochistitelya_gibridnaya_450_mm_/>
Какие стеклоочистители лучше каркасные или бескаркасные или гибридные,"## Какие стеклоочистители лучше каркасные или бескаркасные или гибридные
Итак, какие бывают дворники? Существует три типа — каркасные, бескаркасные и гибридные. Расскажем о каждом подробно, чтобы вы знали, какие лучше купить. 
### Каркасные стеклоочистители
Они хорошо прилегают к стеклу благодаря металлическим пружинам и остаются высокоэффективны в дождь и грязь. однако эти модели подвержены коррозии, поскольку в основе их конструкции — металлический каркас. Также они могут накапливать снег и лед зимой.
![Как выбрать дворники-2](https://sappo.ru/blog/sam-sebe-detailer/kak-vybrat-dvorniki-dlya-avtomobilya-sovety-po-vyboru/?page=1)
### Бескаркасные стеклоочистители
В числе их преимуществ — легкий и современный дизайн. Они устойчивы к обледенению, так как не имеют металлического каркаса. Также бескаркасные дворники эффективны на высоких скоростях благодаря аэродинамической форме. Однако они не всегда хорошо прилегают к сильно изогнутым стеклам и дороже каркасных моделей.
![Как выбрать дворники-3](https://sappo.ru/blog/sam-sebe-detailer/kak-vybrat-dvorniki-dlya-avtomobilya-sovety-po-vyboru/?page=1)
### Гибридные стеклоочистители
Они сочетают точность прилегания каркасных моделей и устойчивость к погодным условиям бескаркасных и обладают стильным дизайном. Подходят для всех типов стекол, включая сильно изогнутые. Если ищете качественный вариант длиной 475 мм, рекомендуем [Denso Hybrid DU-048L](https://sappo.ru/blog/sam-sebe-detailer/kak-vybrat-dvorniki-dlya-avtomobilya-sovety-po-vyboru/<https:/sappo.ru/product/denso_hybrid_du_048l_shchetka_stekloochistitelya_gibridnaya_475_mm_/>). Эти модели долговечны, благодаря прочным материалам и защитным элементам.
![Как выбрать дворники-4](https://sappo.ru/blog/sam-sebe-detailer/kak-vybrat-dvorniki-dlya-avtomobilya-sovety-po-vyboru/?page=1)
Гибридные модели оснащены металлическим каркасом, который обеспечивает плотное прилегание. Благодаря множеству шарнирных точек, эти щетки адаптируются к любой форме лобового стекла, включая сильно изогнутые.
Каркас скрыт под защитным пластиковым или резиновым корпусом. Это позволяет:
  * снизить сопротивление воздуха при движении;
  * уменьшить уровень шума;
  * предотвратить налипание снега и льда. 
Чаще всего гибридные оснащены резиновыми или силиконовыми лезвиями высокого качества, которые обеспечивают мягкое, но эффективное скольжение по стеклу. Специально для автомобилей с левым расположением руля рекомендуем [Denso Hybrid DU-050L](https://sappo.ru/blog/sam-sebe-detailer/kak-vybrat-dvorniki-dlya-avtomobilya-sovety-po-vyboru/<https:/sappo.ru/product/denso_hybrid_du_050l_shchetka_stekloochistitelya_gibridnaya_500_mm_/>) — модель дворников длиной 500 мм. 
Почему гибридные щетки — лучший выбор? Их преимущества:
  * Универсальность. Эти автомобильные дворники подходят для любых погодных условий: летом они эффективно удаляют пыль, грязь и влагу, а зимой корпус предотвращает замерзание механизма. Резина сохраняет эластичность даже при сильном морозе.
  * Долговечность. Использование высококачественных материалов увеличивает срок службы гибридных щеток. Они устойчивы к ультрафиолету, резким перепадам температур и химическим реагентам.
  * Эстетика. Стильный корпус этих аксессуаров вписывается в общий дизайн автомобиля, придавая ему современный вид.
  * Отличное равномерное прилегание стеклоочистителей, что обеспечивает их эффективность на всей длине. Даже мелкие капли или ледяные кристаллы воды убираются быстро и без разводов.
  * Устойчивость на высоких скоростях. Аэродинамическая форма предотвращает отрыв щеток от стекла при движении автомобиля на высокой скорости. 
Чтобы продлить срок службы гибридных стеклоочистителей, придерживайтесь следующих рекомендаций:
  1. Регулярная чистка. Удаляйте грязь и пыль с корпуса и лезвий щеток мягкой тканью.
  2. Проверка состояния: внимание — на трещины или износ резиновой части.
  3. Защита от замерзания. Зимой очищайте стекло от снега и льда перед использованием щеток, чтобы избежать повреждений. 
Гибридные стеклоочистители подойдут, если:
  * автомобиль эксплуатируется в регионах с переменчивыми климатическими условиями;
  * автовладелец ценит долговечность и высокую производительность.
  * важен стильный внешний вид и тишина в работе стеклоочистителей. 
Если необходима модель длиной 700 мм, рекомендуем [Denso Hybrid DU-070L](https://sappo.ru/blog/sam-sebe-detailer/kak-vybrat-dvorniki-dlya-avtomobilya-sovety-po-vyboru/<https:/sappo.ru/product/denso_hybrid_du_070l_shchetka_stekloochistitelya_gibridnaya_700_mm_/>) от надежного японского производителя.","https://sappo.ru/blog/sam-sebe-detailer/kak-vybrat-dvorniki-dlya-avtomobilya-sovety-po-vyboru/<https:/sappo.ru/product/denso_hybrid_du_048l_shchetka_stekloochistitelya_gibridnaya_475_mm_/>, https://sappo.ru/blog/sam-sebe-detailer/kak-vybrat-dvorniki-dlya-avtomobilya-sovety-po-vyboru/<https:/sappo.ru/product/denso_hybrid_du_050l_shchetka_stekloochistitelya_gibridnaya_500_mm_/>, https://sappo.ru/blog/sam-sebe-detailer/kak-vybrat-dvorniki-dlya-avtomobilya-sovety-po-vyboru/<https:/sappo.ru/product/denso_hybrid_du_070l_shchetka_stekloochistitelya_gibridnaya_700_mm_/>"
"Как правильно ухаживать за щетками стеклоочистителя, что нужно учесть","## Как правильно ухаживать за щетками стеклоочистителя, что нужно учесть
Важно правильно выбрать щетки стеклоочистителя, а затем обеспечить надлежащий уход за ними. Основные правила следующие:
  1. Проводите регулярную очистку. Удаляйте пыль, грязь и насекомых с резиновой части мягкой тканью или губкой, смоченной в теплой воде с мыльным раствором.
  2. Избегайте использования агрессивных чистящих средств, которые могут повредить резину или пластик.
  3. Осматривайте резиновые элементы на наличие трещин, износа или деформаций.
  4. Проверьте каркас на отсутствие ржавчины или повреждений.
  5. Защищайте аксессуары от замерзания: зимой не используйте их для удаления льда или снега с лобового стекла. Это может привести к повреждению резины.
  6. Перед поездкой прогрейте стекло, чтобы устранить наледь, или используйте размораживатель.
  7. Используйте качественную стеклоомывающую жидкость, подходящую для текущего времени года. Летом она помогает удалять грязь и насекомых, а зимой предотвращает замерзание стекол и щеток.
  8. В периоды длительного простоя автомобиля (например, в зимнее время) рекомендуется поднимать дворники над стеклом или установить специальные накладки, чтобы избежать деформации резины.
  9. Летом регулярно очищайте щетки от пыли и песка, чтобы предотвратить появление царапин на стекле. Также избегайте длительного нахождения автомобиля на солнце, чтобы резина не теряла эластичность.
  10. Зимой: проверяйте состояние резины после каждого использования в мороз, чтобы убедиться в отсутствии трещин. И не оставляйте щетки прижатыми к стеклу, если прогнозируются минусовые температуры.
  11. Осенью часто очищайте дворники от опавшей листвы, чтобы избежать скопления влаги и грязи.
  12. После зимы тщательно промойте щетки и стекло, чтобы удалить остатки реагентов и соли. 
Чтобы не испортить конструкцию, не используйте абразивные чистящие средства и не включайте дворники на сухом стекле. Сухое трение ускоряет износ резины и может оставить царапины на стекле. Если щетки оставляют разводы, шумят или плохо прилегают к стеклу, своевременно устраняйте неполадки или выполните замену аксессуаров.
Корректный подбор и регулярный уход за щетками стеклоочистителя — это залог их долговечности и эффективности. Своевременная чистка, правильная эксплуатация и использование качественных материалов помогут продлить срок службы дворников и обеспечат вам безопасную поездку в любых погодных условиях.",
